
======================================================================
     FOCUS: a platform for exploring FermiOniC qUantum Simulation     
   							               
       :!!!!!!!!!    ^!!!7!:      :!7!!~~!:!!!!!:  ~!!!. :!!!!7:      
       .^G@P^^~?BJ ~GG!::~Y#P^  ^P#?^:^7G@^:5&#~.  ^J#! 7P:.:?&5      
         5@Y  !J :~&@^     ?&@^^B@?     .?. ?&B     :P  5&J7~^~~      
         5@G!?BB  ?&&:     :B@??&@^         ?&B     :P  .?5GB##P^     
         5@Y  :!  ^B@J     !@#:^B@Y      ^: ?&#     ~P  JJ   .~@5     
       .~G@P^:     ^5#5~^^7GY:  ^5&P7~~!?J: :5&5!~~!Y^  Y&5!^^7G^     
       :~~~~~:       .~!!~^.      .~77!~.     :!7!~^    :::~!!^       
   							               
                    Authors: Zhendong Li @ BNU2019   		       
======================================================================

TIME = Fri Aug 30 23:25:17 2024

GIT_HASH = 6b3a4a9f0ca89752138391044b5517d8093a95ac

mpisize = 2 maxthreads = 8

input file = results/cinput.dat

schedule::read fname = results/cinput.dat
----------------------------------------------------------------------
dtype 1
nelec 6
twom 0
integral_file moleinfo/fmole.info
scratch ./scratch

$sci
dets 
#0 1 2 3 4 5 
0 2 4 7 9 11
end
nroots 2
schedule
0 1.e-5
end
maxiter 3
$end

$ctns
qkind cNK
nroots 2
maxdets 10000
thresh_proj 1.e-15
thresh_ortho 1.e-8 
topology_file topology/topo1
schedule
#0 2 10 1.e-4 0.0
#2 1 10 1.e-4 1.e-4
#4 1 10 1.e-5 0.0
#0 1 20 1.e-2 1.e-4
0 1 60 1.e-5 1.e-5
end
maxsweep 2
task_dmrg
$end

----------------------------------------------------------------------

===== schedule::print =====
scratch = ./scratch
dtype = 1
nelec = 6
twom  = 0
twos  = 0
integral_file = moleinfo/fmole.info
perfcomm = 0

===== params_sci::print =====
nroots = 2
no. of unique seeds = 1
0-th det: 0 2 4 7 9 11 
flip = 0
eps0 = 0.01
miniter = 0
maxiter = 3
schedule: iter eps1
0 1e-05
1 1e-05
2 1e-05
convergence parameters
deltaE = 1e-10
checkms = 0
cisolver = 1
maxcycle = 100
crit_v = 0.0001
ifpt2 = 0
eps2 = 1e-08
iroot = 0
load = 0
ci_file = ci.info
cthrd = 0.01
ifanalysis = 0

===== params_ctns::print =====
qkind = cNK
topology_file = topology/topo1
verbose = 0
task_init = 0
task_sdiag = 0
task_ham = 1
task_opt = 1
task_oodmrg = 0
task_vmc = 0
task_expand = 0
task_tononsu2 = 0
task_prop = 0
task_schmidt = 0
schmidt_file = schmidt_values
restart_sweep = 0
restart_bond = 0
timestamp = 0
maxdets = 10000
thresh_proj = 1.000000e-15
thresh_ortho = 1.000000e-08
rdm_svd = 1.500000e+00
outprec = 12
nroots = 2
guess = 1
dbranch = 0
maxsweep = 2
maxbond = -1
schedule: isweep, dots, dcut, eps, noise
0 1 60 1.000000e-05 1.000000e-05
1 1 60 1.000000e-05 1.000000e-05
alg_hvec = 3
alg_hinter = 0
alg_hcoper = 0
alg_renorm = 2
alg_rinter = 0
alg_rcoper = 0
alg_decim = 1
notrunc = 0
ifdist1 = 0
ifdistc = 0
save_formulae = 0
sort_formulae = 0
save_mmtask = 0
batchhvec = -1 -1 -1
batchrenorm = -1 -1 -1
batchmem = 1.000000e+01
cisolver = 1
maxcycle = 30
nbuff = 4
damping = 1.000000e-10
precond = 1
rcanon_file = 
rcanon2_file = 
iomode = 0
async_fetch = 0
async_save = 0
async_remove = 0
ifnccl = 0
iroot = 0
jroot = 0
nsample = 1000
pthrd = 1.000000e-02
tosu2 = 0
thresh_tosu2 = 1.000000e-08
singlet = 0
inputconf = 
diagcheck = 0
savebin = 0
fromnosym = 0
oodmrg parameters:
 iprt=1
 maxiter=10
 dfac=2
 macroiter=5
 microiter=50
 alpha=5.000000e-01
 thrdopt=1.000000e-04
 thrdloc=1.000000e-06
 nptloc=2.000000e+01
 acceptall=0

io::create_scratch scratch=./scratch

ctns::topology::read fname=topology/topo1
0
1
2
3
4
5

ctns::topology::print ifmps=1 ntotal=6 nphysical=6 nbackbone=6
topo:
 i=0 : 0 
 i=1 : 1 
 i=2 : 2 
 i=3 : 3 
 i=4 : 4 
 i=5 : 5 
rcoord:
 idx=0 coord=(5,0) rindex=0 node: lindex=5 porb=5 type=0 center=(-1,-1) left=(4,0) right=(-2,-2)
 idx=1 coord=(4,0) rindex=1 node: lindex=4 porb=4 type=1 center=(-1,-1) left=(3,0) right=(5,0)
 idx=2 coord=(3,0) rindex=2 node: lindex=3 porb=3 type=1 center=(-1,-1) left=(2,0) right=(4,0)
 idx=3 coord=(2,0) rindex=3 node: lindex=2 porb=2 type=1 center=(-1,-1) left=(1,0) right=(3,0)
 idx=4 coord=(1,0) rindex=4 node: lindex=1 porb=1 type=1 center=(-1,-1) left=(0,0) right=(2,0)
 idx=5 coord=(0,0) rindex=5 node: lindex=0 porb=0 type=0 center=(-1,-1) left=(-2,-2) right=(1,0)
rsupport/lsupport:
 idx=0 coord=(5,0) rsupport: 5 ; lsupport: 0 1 2 3 4 
 idx=1 coord=(4,0) rsupport: 4 5 ; lsupport: 0 1 2 3 
 idx=2 coord=(3,0) rsupport: 3 4 5 ; lsupport: 0 1 2 
 idx=3 coord=(2,0) rsupport: 2 3 4 5 ; lsupport: 0 1 
 idx=4 coord=(1,0) rsupport: 1 2 3 4 5 ; lsupport: 0 
 idx=5 coord=(0,0) rsupport: 0 1 2 3 4 5 ; lsupport: 
corbs/rorbs/lorbs:
 idx=0 coord=(5,0) corbs: 5 ; rorbs: ; lorbs: 0 1 2 3 4 
 idx=1 coord=(4,0) corbs: 4 ; rorbs: 5 ; lorbs: 0 1 2 3 
 idx=2 coord=(3,0) corbs: 3 ; rorbs: 4 5 ; lorbs: 0 1 2 
 idx=3 coord=(2,0) corbs: 2 ; rorbs: 3 4 5 ; lorbs: 0 1 
 idx=4 coord=(1,0) corbs: 1 ; rorbs: 2 3 4 5 ; lorbs: 0 
 idx=5 coord=(0,0) corbs: 0 ; rorbs: 1 2 3 4 5 ; lorbs: 
image2:
 0 1 2 3 4 5 6 7 8 9 10 11

fci::ci_load fname=./scratch/ci.info

ctns::rcanon_init qkind=qNK
Intel MKL WARNING: Support of Intel(R) Streaming SIMD Extensions 4.2 (Intel(R) SSE4.2) enabled only processors has been deprecated. Intel oneAPI Math Kernel Library 2025.0 will require Intel(R) Advanced Vector Extensions (Intel(R) AVX) instructions.

fci::ci_truncate ciconfs=399 maxdets=10000 ifortho=1
 iroot=0 <CI[trunc]|CI>=(1.000000000000e+00,0.000000000000e+00)
 iroot=1 <CI[trunc]|CI>=(1.000000000000e+00,0.000000000000e+00)

ctns::init_rbases rdm_svd=1.500e+00 thresh_proj=1.000e-15

idx=2 node=(3,0) type=1 rsupport=3 4 5 

idx=5 node=(0,0) type=0 rsupport=0 1 2 3 4 5 

idx=4 node=(1,0) type=1 rsupport=1 2 3 4 5 

idx=1 node=(4,0) type=1 rsupport=4 5 

idx=0 node=(5,0) type=0 rsupport=5 

idx=3 node=(2,0) type=1 rsupport=2 3 4 5 
ctns::right_projection<qNK> thresh_proj=ctns::right_projection<qNK> thresh_proj=1e-15
1.000e-15
ctns::right_projection<qNK> thresh_proj=1.000e-15
ctns::right_projection<qNK> thresh_proj=1.000e-15
ctns::right_projection<qNK> thresh_proj=1.000e-15
 dim(space,lspace,rspace)=399,196,16 dimBc=16 1-popBc=-4.441e-16 SvN=1.325e+00
----- TIMING FOR ctns::right_projection<qNK> : 1.677e-02 S -----
 dim(space,lspace,rspace)=399,1,400 dimBc=4 1-popBc=2.22e-16 SvN=0.693
----- TIMING FOR ctns::right_projection<qNK> : 1.697e-02 S -----
 dim(space,lspace,rspace)=399,64,64 dimBc=64 1-popBc=-1.11e-15 SvN=1.93
----- TIMING FOR ctns::right_projection<qNK> : 1.969e-02 S -----
 dim(space,lspace,rspace)=399,4,400 dimBc=16 1-popBc=-6.66e-16 SvN=1.77
----- TIMING FOR ctns::right_projection<qNK> : 1.988e-02 S -----
 dim(space,lspace,rspace)=399,16,196 dimBc=64 1-popBc=-4.44e-16 SvN=1.48
----- TIMING FOR ctns::right_projection<qNK> : 2.138e-02 S -----

generated rbases with thresh_proj=1e-15
 idx=0 node=(5,0) type=0 shape=4,4 1-popBc=0.000e+00
 idx=1 node=(4,0) type=1 shape=16,16 1-popBc=-4.441e-16
 idx=2 node=(3,0) type=1 shape=64,64 1-popBc=-1.110e-15
 idx=3 node=(2,0) type=1 shape=196,64 1-popBc=-4.441e-16
 idx=4 node=(1,0) type=1 shape=400,16 1-popBc=-6.661e-16
 idx=5 node=(0,0) type=0 shape=400,4 1-popBc=2.220e-16
maximum bond dimension = 64
----- TIMING FOR ctns::init_rbases : 2.240e-02 S -----

ctns::init_rsites qkind=qNK thresh_ortho=1e-08
 idx=0 node=(5,0)[0] shape(l,r,c)=(4,1,4) maxdiff=0.000e+00 deviate=0 TIMING=6.100e-05 S
 idx=1 node=(4,0)[1] shape(l,r,c)=(16,4,4) maxdiff=8.882e-16 deviate=0 TIMING=2.050e-04 S
 idx=2 node=(3,0)[1] shape(l,r,c)=(64,16,4) maxdiff=2.633e-15 deviate=0 TIMING=1.800e-04 S
 idx=3 node=(2,0)[1] shape(l,r,c)=(64,64,4) maxdiff=5.599e-15 deviate=0 TIMING=2.270e-04 S
 idx=4 node=(1,0)[1] shape(l,r,c)=(16,64,4) maxdiff=2.197e-15 deviate=0 TIMING=2.840e-04 S
 idx=5 node=(0,0)[0] shape(l,r,c)=(4,16,4) maxdiff=9.434e-16 deviate=0 TIMING=3.160e-04 S
----- TIMING FOR ctns::init_rsites : 2.639e-03 S -----

ctns::init_rwfuns qkind=qNK thresh_ortho=1e-08
qtensor2: wf2 own=1 _data=0x600000552800
qinfo2: wf2 sym=(0) dir=0,1
 qbond: qrow nsym=1 dimAll=2
 (6):2
 qbond: qcol nsym=1 dimAll=4
 (6):4
total no. of nonzero blocks=1 nblocks=1 size=8:0.000122MB

check state overlaps ...
matrix: ova_rwfuns size=(2,2)
(1.0000e+00,-0.0000e+00) (5.9784e-17,-0.0000e+00) 
(5.9784e-17,-0.0000e+00) (1.0000e+00,-0.0000e+00) 
matrix: ova0_vs size=(2,2)
(1.0000e+00,0.0000e+00) (-3.4694e-17,0.0000e+00) 
(-3.4694e-17,0.0000e+00) (1.0000e+00,0.0000e+00) 
diff of ova matrices = 8.192e-16
----- TIMING FOR ctns::init_rwfuns : 9.270e-04 S -----

ctns::init_rcanon thresh_ortho=1e-08

ctns::rcanon_CIovlp reorder=1 cistates=2 ciconfs=399
matrix: <CI|CTNS[0]> size=(2,2)
(1.0000e+00,1.2068e-19) (-5.7784e-17,-5.7133e-18) 
(-5.6177e-17,1.6300e-18) (1.0000e+00,1.9549e-19) 

matrix: <CTNS[0]|CTNS[0]> size=(2,2)
(1.0000e+00,4.7354e-19) (-5.0460e-17,-5.9863e-18) 
(-7.7753e-17,8.7302e-18) (1.0000e+00,5.9940e-19) 

rcanon::rcanon_canonicalize ifortho=1 ifab=1 nroots=2 dmax=64
----- TIMING FOR ctns::rcanon_canonicalize : 1.384e-02 S -----

matrix: <CTNS[new]|CTNS[new]> size=(2,2)
(1.0000e+00,-8.3679e-19) (3.7610e-16,-3.6203e-18) 
(3.7357e-16,-5.3107e-17) (1.0000e+00,-4.8773e-19) 

matrix: <CTNS[0]|CTNS[new]> size=(2,2)
(3.3767e-10,6.2788e-12) (1.0000e+00,5.9168e-18) 
(-2.6496e-17,1.0000e+00) (-6.2789e-12,-3.3767e-10) 

ctns::rcanon_CIovlp reorder=1 cistates=2 ciconfs=399
matrix: <CI|CTNS[new]> size=(2,2)
(3.3767e-10,6.2787e-12) (1.0000e+00,6.6095e-18) 
(-2.6560e-17,1.0000e+00) (-6.2787e-12,-3.3767e-10) 

ctns::rcanon_check thresh_ortho=1.000e-08
 idx=0 node=(5,0) Drow=4 maxdiff=0.000e+00 deviate=0
 idx=1 node=(4,0) Drow=16 maxdiff=1.896e-15 deviate=0
 idx=2 node=(3,0) Drow=64 maxdiff=3.978e-15 deviate=0
 idx=3 node=(2,0) Drow=64 maxdiff=5.823e-15 deviate=0
 idx=4 node=(1,0) Drow=16 maxdiff=1.817e-15 deviate=0
 idx=5 node=(0,0) Drow=2 maxdiff=4.442e-16 deviate=0
qtensor2: wf2 own=1 _data=0x600003e7e340
qinfo2: wf2 sym=(0) dir=0,1
 qbond: qrow nsym=1 dimAll=2
 (6):2
 qbond: qcol nsym=1 dimAll=2
 (6):2
total no. of nonzero blocks=1 nblocks=1 size=4:6.104e-05MB
i=0 idx=0 block[0:(6),0:(6)] dim0,dim1=(2,2) size=4
 dtensor2: blk_0 size=(2,2) _data=0x600003e7e340
(1.0000e+00,0.0000e+00) (-1.0635e-19,0.0000e+00) 
(-1.0635e-19,0.0000e+00) (-1.0000e+00,0.0000e+00) 
check wf2*wf2.H():
 rwfuns: nroots=2 maxdiff=7.3113e-26 deviate=0
----- TIMING FOR ctns::rcanon_check : 2.170e-04 S -----
----- TIMING FOR ctns::rcanon_init : 1.255e-01 S -----

ctns::rcanon_save fname=./scratch/rcanon_ci

ctns::rcanon_check thresh_ortho=1.000e-08
 idx=0 node=(5,0) Drow=4 maxdiff=0.000e+00 deviate=0
 idx=1 node=(4,0) Drow=16 maxdiff=1.896e-15 deviate=0
 idx=2 node=(3,0) Drow=64 maxdiff=3.978e-15 deviate=0
 idx=3 node=(2,0) Drow=64 maxdiff=5.823e-15 deviate=0
 idx=4 node=(1,0) Drow=16 maxdiff=1.817e-15 deviate=0
 idx=5 node=(0,0) Drow=2 maxdiff=4.442e-16 deviate=0
qtensor2: wf2 own=1 _data=0x600003e7cdc0
qinfo2: wf2 sym=(0) dir=0,1
 qbond: qrow nsym=1 dimAll=2
 (6):2
 qbond: qcol nsym=1 dimAll=2
 (6):2
total no. of nonzero blocks=1 nblocks=1 size=4:6.104e-05MB
i=0 idx=0 block[0:(6),0:(6)] dim0,dim1=(2,2) size=4
 dtensor2: blk_0 size=(2,2) _data=0x600003e7cdc0
(1.0000e+00,0.0000e+00) (-1.0635e-19,0.0000e+00) 
(-1.0635e-19,0.0000e+00) (-1.0000e+00,0.0000e+00) 
check wf2*wf2.H():
 rwfuns: nroots=2 maxdiff=7.3113e-26 deviate=0
----- TIMING FOR ctns::rcanon_check : 2.430e-04 S -----

integral::load fname = moleinfo/fmole.info
 sorb = 12
 size(int1e) = 144:0.0022MB:2.15e-06GB
 size(int2e) = 2277:0.0347MB:3.39e-05GB
 ecore = (4.6,0)
----- TIMING FOR integral::load : 1.111e-03 S -----

io::remove_scratch scratch=./scratch/sweep
successfully removed ./scratch/sweep

io::create_scratch scratch=./scratch/sweep
successfully created ./scratch/sweep

ctns::oper_env_right qkind=qNK
ctns::oper_save iomode=0 fname=./scratch/sweep/cop(5,0) size=0.00378MB:3.7e-06GB
fname=./scratch/sweep/cop(5,0) size=3.7e-06GB T[save](info/data/tot)=0.000173,5.6e-05,0.000229 speed=0.0161GB/s disk[used]=3.9e-06GB
ctns::oper_save iomode=0 fname=./scratch/sweep/rop(5,0) size=0.00378MB:3.7e-06GB
Intel MKL WARNING: Support of Intel(R) Streaming SIMD Extensions 4.2 (Intel(R) SSE4.2) enabled only processors has been deprecated. Intel oneAPI Math Kernel Library 2025.0 will require Intel(R) Advanced Vector Extensions (Intel(R) AVX) instructions.
fname=./scratch/sweep/rop(5,0) size=3.7e-06GB T[save](info/data/tot)=7e-05,4.8e-05,0.000118 speed=0.0313GB/s disk[used]=7.8e-06GB
ctns::oper_save iomode=0 fname=./scratch/sweep/cop(4,0) size=0.00378MB:3.7e-06GB
fname=./scratch/sweep/cop(4,0) size=3.7e-06GB T[save](info/data/tot)=6.6e-05,4.8e-05,0.000114 speed=0.0324GB/s disk[used]=1.17e-05GB
ctns::oper_save iomode=0 fname=./scratch/sweep/cop(3,0) size=0.00378MB:3.7e-06GB
fname=./scratch/sweep/cop(3,0) size=3.7e-06GB T[save](info/data/tot)=6.9e-05,5e-05,0.000119 speed=0.0311GB/s disk[used]=1.56e-05GB
ctns::oper_save iomode=0 fname=./scratch/sweep/cop(2,0) size=0.00378MB:3.7e-06GB
fname=./scratch/sweep/cop(2,0) size=3.7e-06GB T[save](info/data/tot)=6.9e-05,5.2e-05,0.000121 speed=0.0305GB/s disk[used]=1.95e-05GB
ctns::oper_save iomode=0 fname=./scratch/sweep/cop(1,0) size=0.00378MB:3.7e-06GB
fname=./scratch/sweep/cop(1,0) size=3.7e-06GB T[save](info/data/tot)=6.7e-05,4.7e-05,0.000114 speed=0.0324GB/s disk[used]=2.34e-05GB
ctns::oper_save iomode=0 fname=./scratch/sweep/cop(0,0) size=0.00378MB:3.7e-06GB
fname=./scratch/sweep/cop(0,0) size=3.7e-06GB T[save](info/data/tot)=6.9e-05,4.7e-05,0.000116 speed=0.0319GB/s disk[used]=2.73e-05GB
----- TIMING FOR ctns::oper_init_dotCR : 3.849e-03 S -----
T[ctns::oper_init_dotCR](comp/save/tot)=0.00248,0.00122,0.00371

idx=1 coord=(4,0)
 qops: oplist=CABPQSH nops=C:2 A:2 B:3 P:13 Q:16 S:4 H:1 
        dim(bra,ket)=16,16 size(op)=70:0.00107MB size(tot)=2156:0.0329MB:3.21e-05GB
CPUmem: VM:0.000e+00GB RSS:0.000e+00GB  Timing: User:9.107e-01S Sys:1.554e-01S Total:1.066e+00S
check ||H-H.dagger||=0.000e+00 coord=(4,0) rank=0
----- TIMING FOR oper_renorm : 0.00221 S T(init/kernel/comm)=-1.73e+09,1.73e+09,7.6e-05 rank=0 -----

idx=2 coord=(3,0)
 qops: oplist=CABPQSH nops=C:3 A:5 B:7 P:6 Q:8 S:3 H:1 
        dim(bra,ket)=64,64 size(op)=924:0.0141MB size(tot)=24981:0.381MB:0.000372GB
CPUmem: VM:0.000e+00GB RSS:0.000e+00GB  Timing: User:1.197e+00S Sys:2.249e-01S Total:1.422e+00S
check ||H-H.dagger||=0.000e+00 coord=(3,0) rank=0
----- TIMING FOR oper_renorm : 0.00402 S T(init/kernel/comm)=-1.73e+09,1.73e+09,7.5e-05 rank=0 -----

idx=3 coord=(2,0)
 qops: oplist=CABPQSH nops=C:4 A:10 B:13 P:1 Q:2 S:2 H:1 
        dim(bra,ket)=64,64 size(op)=1120:0.0171MB size(tot)=28224:0.431MB:0.000421GB
CPUmem: VM:0.000e+00GB RSS:0.000e+00GB  Timing: User:1.208e+00S Sys:2.275e-01S Total:1.435e+00S
check ||H-H.dagger||=0.000e+00 coord=(2,0) rank=0
----- TIMING FOR oper_renorm : 0.00358 S T(init/kernel/comm)=-1.73e+09,1.73e+09,6.4e-05 rank=0 -----

idx=4 coord=(1,0)
 qops: oplist=CABPQSH nops=C:5 A:15 B:18 P:1 Q:2 S:1 H:1 
        dim(bra,ket)=16,16 size(op)=96:0.00146MB size(tot)=2656:0.0405MB:3.96e-05GB
CPUmem: VM:0.000e+00GB RSS:0.000e+00GB  Timing: User:1.224e+00S Sys:2.330e-01S Total:1.457e+00S
check ||H-H.dagger||=0.000e+00 coord=(1,0) rank=0
----- TIMING FOR oper_renorm : 0.00435 S T(init/kernel/comm)=-1.73e+09,1.73e+09,0.000114 rank=0 -----

idx=5 coord=(0,0)
 qops: oplist=CABPQSH nops=C:6 A:22 B:26 P:0 Q:0 S:0 H:1 
        dim(bra,ket)=2,2 size(op)=4:6.1e-05MB size(tot)=108:0.00165MB:1.61e-06GB
CPUmem: VM:0.000e+00GB RSS:0.000e+00GB  Timing: User:1.235e+00S Sys:2.361e-01S Total:1.471e+00S
check ||H-H.dagger||=0.000e+00 coord=(0,0) rank=0
----- TIMING FOR oper_renorm : 0.000764 S T(init/kernel/comm)=-1.73e+09,1.73e+09,1e-05 rank=0 -----
----- TIMING FOR ctns::oper_env_right : 7.526e-02 S -----
T[ctns::oper_env_right](init/load/comp/save/tot)=0.00386,0.00241,0.015,0.0539,0.0752
ctns::oper_load iomode=0 fname=./scratch/sweep/rop(0,0)
fname=./scratch/sweep/rop(0,0) size=1.61e-06GB T[load](info/setup/data/tot)=3.1e-05,0.000213,1.1e-05,0.000255 speed=0.00631GB/s
matrix: Hij size=(2,2)
(-2.884885193729e+00,0.000000000000e+00) (-1.185814335530e-10,0.000000000000e+00) 
(-1.185814335530e-10,0.000000000000e+00) (-3.236061715657e+00,0.000000000000e+00) 
matrix: Sij size=(2,2)
(1.000000000000e+00,-8.367853178497e-19) (3.760995452492e-16,-3.620256900731e-18) 
(3.735664896897e-16,-5.310660322860e-17) (1.000000000000e+00,-4.877306080365e-19) 

ctns::sweep_opt maxsweep=2

ctns::oper_init_dotL isym=1 ifkr=1 singlet=0
ctns::oper_save iomode=0 fname=./scratch/sweep/lop(0,0) size=0.0037841796875MB:3.69548797607e-06GB
fname=./scratch/sweep/lop(0,0) size=3.7e-06GB T[save](info/data/tot)=7.8e-05,5.9e-05,0.000137 speed=0.027GB/s disk[used]=0.000898GB
----- TIMING FOR ctns::oper_init_dotL : 6.080e-04 S -----

ctns::topology::get_sweeps ifboundary=0
 ibond=0 bond=(1,0)-(2,0) forward=1 cturn=0
 ibond=1 bond=(2,0)-(3,0) forward=1 cturn=0
 ibond=2 bond=(3,0)-(4,0) forward=1 cturn=0
 ibond=3 bond=(3,0)-(4,0) forward=0 cturn=0
 ibond=4 bond=(2,0)-(3,0) forward=0 cturn=0
 ibond=5 bond=(1,0)-(2,0) forward=0 cturn=0
..... end of get_sweeps .....

======================================================================
sweep parameters: isweep=0 dots=1 dcut=60 eps=1e-05 noise=1e-05
======================================================================

ctns::sweep_init: nroots=2 sym_state=(6) singlet=0
qtensor3: site0new own=1 _data=0x600000f50a20
qinfo3: site0new sym=(0) dir=1,0,1
 qbond: qrow nsym=1 dimAll=1
 (0):1
 qbond: qcol nsym=3 dimAll=4
 (0):1 (2):1 (1):2
 qbond: qmid nsym=3 dimAll=4
 (0):1 (2):1 (1):2
total no. of nonzero blocks=3 nblocks=9 size=6:9.16e-05MB
comb::display_size qkind=qNK
 rbases: len=6 mem=24:0.000366MB:3.58e-07GB
 sites: len=6 mem=5822:0.0888MB:8.68e-05GB
 rwfuns: len=2 mem=4:6.1e-05MB:5.96e-08GB
 cpsi: len=2 mem=560:0.00854MB:8.34e-06GB
total mem of comb=6410:0.0978MB:9.55e-05GB

isweep=0 ibond=0/seqsize=6 dots=1 dbond=(1,0)-(2,0) forward=1 cturn=0
----------------------------------------------------------------------
ctns::sweep_onedot ifabelian=1 alg_hvec=3 alg_renorm=2 mpisize=2 maxthreads=8
CPUmem: VM:4.291e+09GB RSS:2.670e-05GB  Timing: User:1.241e+00S Sys:2.393e-01S Total:1.480e+00S
comb::display_size qkind=qNK
 rbases: len=6 mem=24:3.662e-04MB:3.576e-07GB
 sites: len=6 mem=5822:8.884e-02MB:8.675e-05GB
 rwfuns: len=2 mem=4:6.104e-05MB:5.960e-08GB
 cpsi: len=2 mem=560:8.545e-03MB:8.345e-06GB
total mem of comb=6410:9.781e-02MB:9.552e-05GB
ctns::topology::check_partition: (sl,sr,sc)=1,4,1 ifNC=1
wf3(diml,dimr,dimc)=(4,64,4) nnz=280:4.272e-03MB
qtensor3: wf3 own=1 _data=0x7fdb14832e00
qinfo3: wf3 sym=(6) dir=1,1,1
 qbond: qrow nsym=3 dimAll=4
 (0):1 (2):1 (1):2
 qbond: qcol nsym=5 dimAll=64
 (4):24 (3):16 (5):16 (2):4 (6):4
 qbond: qmid nsym=3 dimAll=4
 (0):1 (2):1 (1):2
total no. of nonzero blocks=9 nblocks=45 size=280:4.272e-03MB
duration_diagGPU:1.710e-04
duration_diagreduce:2.300e-05
duration_diagtransform:2.000e-06
iter   ieig        eigenvalue        ediff      rnorm   nsub  nmvp   time/s    tav/s
    1   0 -      -3.236061715657 -1.003e+03  2.453e-03    2     2  4.792e-03 2.396e-03
    1   1 -      -2.884885193729 -1.003e+03  4.206e-05    2     2  4.792e-03 2.396e-03
    2   0 -      -3.236066184654 -4.469e-06  3.484e-04    4     4  1.022e-02 2.554e-03
    2   1 +      -2.884885194415 -6.861e-10  6.248e-06    4     4  1.022e-02 2.554e-03
    3   0 -      -3.236066263526 -7.887e-08  1.345e-04    5     5  1.297e-02 2.595e-03
    3   1 +      -2.884885194415  8.882e-16  6.248e-06    5     5  1.297e-02 2.595e-03
    4   0 -      -3.236066275246 -1.172e-08  5.539e-05    4     6  1.593e-02 2.655e-03
    4   1 +      -2.884885194415  4.441e-16  6.248e-06    4     6  1.593e-02 2.655e-03
    5   0 -      -3.236066277977 -2.731e-09  2.893e-05    4     7  1.880e-02 2.685e-03
    5   1 +      -2.884885194415  4.441e-16  6.248e-06    4     7  1.880e-02 2.685e-03
    6   0 -      -3.236066278678 -7.013e-10  1.200e-05    4     8  2.103e-02 2.629e-03
    6   1 +      -2.884885194415  8.882e-16  6.248e-06    4     8  2.103e-02 2.629e-03
    7   0 +      -3.236066278787 -1.083e-10  4.355e-06    4     9  2.324e-02 2.583e-03
    7   1 +      -2.884885194415 -4.441e-16  6.248e-06    4     9  2.324e-02 2.583e-03
TIMING FOR Davidson : 2.393e-02  T(cal/comm/sub/rest)=1.095e-02,7.748e-03,3.640e-04,4.874e-03
optimized energies: isweep=0 ibond=0 dots=1 e[0]=-3.23606627879 nmvp=9
optimized energies: isweep=0 ibond=0 dots=1 e[1]=-2.88488519441 nmvp=9
CPUmem: VM:7.451e-09GB RSS:2.670e-04GB  Timing: User:1.334e+00S Sys:2.695e-01S Total:1.603e+00S
 qops: oplist=CABPQSH nops=C:2 A:1 B:2 P:10 Q:13 S:4 H:1 
        dim(bra,ket)=16,16 size(op)=70:1.068e-03MB size(tot)=1764:2.692e-02MB:2.629e-05GB
CPUmem: VM:0.000e+00GB RSS:0.000e+00GB  Timing: User:1.339e+00S Sys:2.720e-01S Total:1.611e+00S
check ||H-H.dagger||=0.000e+00 coord=(1,0) rank=0
----- TIMING FOR oper_renorm : 0.00178 S T(init/kernel/comm)=-1.73e+09,1.73e+09,3e-05 rank=0 -----
CPUmem: VM:7.451e-09GB RSS:4.027e+08GB  Timing: User:1.346e+00S Sys:2.733e-01S Total:1.619e+00S
comb::display_size qkind=qNK
 rbases: len=6 mem=24:3.662e-04MB:3.576e-07GB
 sites: len=6 mem=4772:7.281e-02MB:7.111e-05GB
 rwfuns: len=2 mem=4:6.104e-05MB:5.960e-08GB
 cpsi: len=2 mem=1848:2.820e-02MB:2.754e-05GB
total mem of comb=6648:1.014e-01MB:9.906e-05GB
----- TIMING FOR cleanup: 7.450e-04 T(join&erase/save/remove)=2.460e-04,3.580e-04,1.410e-04 S -----
CPUmem: VM:1.863e-09GB RSS:4.027e+08GB  Timing: User:1.349e+00S Sys:2.749e-01S Total:1.624e+00S

isweep=0 ibond=1/seqsize=6 dots=1 dbond=(2,0)-(3,0) forward=1 cturn=0
----------------------------------------------------------------------
ctns::sweep_onedot ifabelian=1 alg_hvec=3 alg_renorm=2 mpisize=2 maxthreads=8
CPUmem: VM:1.863e-09GB RSS:4.027e+08GB  Timing: User:1.349e+00S Sys:2.750e-01S Total:1.624e+00S
comb::display_size qkind=qNK
 rbases: len=6 mem=24:3.662e-04MB:3.576e-07GB
 sites: len=6 mem=4772:7.281e-02MB:7.111e-05GB
 rwfuns: len=2 mem=4:6.104e-05MB:5.960e-08GB
 cpsi: len=2 mem=1848:2.820e-02MB:2.754e-05GB
total mem of comb=6648:1.014e-01MB:9.906e-05GB
ctns::topology::check_partition: (sl,sr,sc)=2,3,1 ifNC=1
wf3(diml,dimr,dimc)=(16,64,4) nnz=924:1.410e-02MB
qtensor3: wf3 own=1 _data=0x7fdb13812600
qinfo3: wf3 sym=(6) dir=1,1,1
 qbond: qrow nsym=5 dimAll=16
 (0):1 (2):6 (1):4 (4):1 (3):4
 qbond: qcol nsym=7 dimAll=64
 (3):20 (2):15 (4):15 (1):6 (5):6 (0):1 (6):1
 qbond: qmid nsym=3 dimAll=4
 (0):1 (2):1 (1):2
total no. of nonzero blocks=15 nblocks=105 size=924:1.410e-02MB
duration_diagGPU:5.330e-04
duration_diagreduce:1.700e-05
duration_diagtransform:3.000e-06
iter   ieig        eigenvalue        ediff      rnorm   nsub  nmvp   time/s    tav/s
    1   0 -      -3.236066278787 -1.003e+03  6.731e-05    2     2  7.208e-03 3.604e-03
    1   1 -      -2.884885194415 -1.003e+03  1.419e-04    2     2  7.208e-03 3.604e-03
    2   0 +      -3.236066279863 -1.077e-09  7.214e-06    4     4  1.375e-02 3.438e-03
    2   1 -      -2.884885200059 -5.644e-09  2.059e-05    4     4  1.375e-02 3.438e-03
    3   0 +      -3.236066279863 -8.882e-16  7.214e-06    5     5  1.728e-02 3.456e-03
    3   1 +      -2.884885200198 -1.394e-10  4.322e-06    5     5  1.728e-02 3.456e-03
TIMING FOR Davidson : 1.975e-02  T(cal/comm/sub/rest)=1.113e-02,4.270e-04,3.380e-04,7.851e-03
optimized energies: isweep=0 ibond=1 dots=1 e[0]=-3.23606627986 nmvp=5
optimized energies: isweep=0 ibond=1 dots=1 e[1]=-2.8848852002 nmvp=5
CPUmem: VM:0.000e+00GB RSS:5.341e-05GB  Timing: User:1.440e+00S Sys:3.001e-01S Total:1.741e+00S
 qops: oplist=CABPQSH nops=C:3 A:6 B:8 P:5 Q:7 S:3 H:1 
        dim(bra,ket)=60,60 size(op)=902:1.376e-02MB size(tot)=23607:3.602e-01MB:3.518e-04GB
CPUmem: VM:0.000e+00GB RSS:0.000e+00GB  Timing: User:1.495e+00S Sys:3.229e-01S Total:1.817e+00S
check ||H-H.dagger||=0.000e+00 coord=(2,0) rank=0
----- TIMING FOR oper_renorm : 0.00194 S T(init/kernel/comm)=-1.73e+09,1.73e+09,5.5e-05 rank=0 -----
CPUmem: VM:0.000e+00GB RSS:4.027e+08GB  Timing: User:1.502e+00S Sys:3.244e-01S Total:1.826e+00S
comb::display_size qkind=qNK
 rbases: len=6 mem=24:3.662e-04MB:3.576e-07GB
 sites: len=6 mem=1986:3.030e-02MB:2.959e-05GB
 rwfuns: len=2 mem=4:6.104e-05MB:5.960e-08GB
 cpsi: len=2 mem=1820:2.777e-02MB:2.712e-05GB
total mem of comb=3834:5.850e-02MB:5.713e-05GB
----- TIMING FOR cleanup: 5.480e-04 T(join&erase/save/remove)=5.500e-05,3.810e-04,1.120e-04 S -----
CPUmem: VM:1.863e-09GB RSS:4.027e+08GB  Timing: User:1.503e+00S Sys:3.257e-01S Total:1.829e+00S

isweep=0 ibond=2/seqsize=6 dots=1 dbond=(3,0)-(4,0) forward=1 cturn=0
----------------------------------------------------------------------
ctns::sweep_onedot ifabelian=1 alg_hvec=3 alg_renorm=2 mpisize=2 maxthreads=8
CPUmem: VM:1.863e-09GB RSS:4.027e+08GB  Timing: User:1.504e+00S Sys:3.257e-01S Total:1.829e+00S
comb::display_size qkind=qNK
 rbases: len=6 mem=24:3.662e-04MB:3.576e-07GB
 sites: len=6 mem=1986:3.030e-02MB:2.959e-05GB
 rwfuns: len=2 mem=4:6.104e-05MB:5.960e-08GB
 cpsi: len=2 mem=1820:2.777e-02MB:2.712e-05GB
total mem of comb=3834:5.850e-02MB:5.713e-05GB
ctns::topology::check_partition: (sl,sr,sc)=3,2,1 ifNC=0
wf3(diml,dimr,dimc)=(60,16,4) nnz=910:1.389e-02MB
qtensor3: wf3 own=1 _data=0x7fdb12856200
qinfo3: wf3 sym=(6) dir=1,1,1
 qbond: qrow nsym=5 dimAll=60
 (3):20 (2):15 (4):15 (5):6 (1):4
 qbond: qcol nsym=5 dimAll=16
 (2):6 (1):4 (3):4 (0):1 (4):1
 qbond: qmid nsym=3 dimAll=4
 (0):1 (2):1 (1):2
total no. of nonzero blocks=13 nblocks=75 size=910:1.389e-02MB
duration_diagGPU:6.230e-04
duration_diagreduce:1.700e-05
duration_diagtransform:3.000e-06
iter   ieig        eigenvalue        ediff      rnorm   nsub  nmvp   time/s    tav/s
    1   0 -      -3.236066275731 -1.003e+03  1.688e-05    2     2  6.948e-03 3.474e-03
    1   1 +      -2.884885199035 -1.003e+03  7.343e-06    2     2  6.948e-03 3.474e-03
    2   0 +      -3.236066275824 -9.347e-11  3.616e-06    3     3  1.062e-02 3.540e-03
    2   1 +      -2.884885199035 -6.217e-15  7.343e-06    3     3  1.062e-02 3.540e-03
TIMING FOR Davidson : 1.239e-02  T(cal/comm/sub/rest)=6.612e-03,5.850e-04,1.670e-04,5.028e-03
optimized energies: isweep=0 ibond=2 dots=1 e[0]=-3.23606627582 nmvp=3
optimized energies: isweep=0 ibond=2 dots=1 e[1]=-2.88488519903 nmvp=3
CPUmem: VM:0.000e+00GB RSS:4.005e-04GB  Timing: User:1.555e+00S Sys:3.392e-01S Total:1.894e+00S
 qops: oplist=CABPQSH nops=C:4 A:13 B:16 P:2 Q:3 S:2 H:1 
        dim(bra,ket)=60,60 size(op)=1054:1.608e-02MB size(tot)=31541:4.813e-01MB:4.700e-04GB
CPUmem: VM:0.000e+00GB RSS:0.000e+00GB  Timing: User:1.596e+00S Sys:3.603e-01S Total:1.957e+00S
check ||H-H.dagger||=0.000e+00 coord=(3,0) rank=0
----- TIMING FOR oper_renorm : 0.00383 S T(init/kernel/comm)=-1.73e+09,1.73e+09,7.6e-05 rank=0 -----
CPUmem: VM:0.000e+00GB RSS:4.027e+08GB  Timing: User:1.611e+00S Sys:3.632e-01S Total:1.974e+00S
comb::display_size qkind=qNK
 rbases: len=6 mem=24:3.662e-04MB:3.576e-07GB
 sites: len=6 mem=4559:6.956e-02MB:6.793e-05GB
 rwfuns: len=2 mem=4:6.104e-05MB:5.960e-08GB
 cpsi: len=2 mem=542:8.270e-03MB:8.076e-06GB
total mem of comb=5129:7.826e-02MB:7.643e-05GB
----- TIMING FOR cleanup: 5.660e-04 T(join&erase/save/remove)=6.900e-05,4.090e-04,8.800e-05 S -----
CPUmem: VM:9.313e-10GB RSS:4.027e+08GB  Timing: User:1.612e+00S Sys:3.643e-01S Total:1.976e+00S

isweep=0 ibond=3/seqsize=6 dots=1 dbond=(3,0)-(4,0) forward=0 cturn=0
----------------------------------------------------------------------
ctns::sweep_onedot ifabelian=1 alg_hvec=3 alg_renorm=2 mpisize=2 maxthreads=8
CPUmem: VM:9.313e-10GB RSS:4.027e+08GB  Timing: User:1.612e+00S Sys:3.644e-01S Total:1.976e+00S
comb::display_size qkind=qNK
 rbases: len=6 mem=24:3.662e-04MB:3.576e-07GB
 sites: len=6 mem=4559:6.956e-02MB:6.793e-05GB
 rwfuns: len=2 mem=4:6.104e-05MB:5.960e-08GB
 cpsi: len=2 mem=542:8.270e-03MB:8.076e-06GB
total mem of comb=5129:7.826e-02MB:7.643e-05GB
ctns::topology::check_partition: (sl,sr,sc)=4,1,1 ifNC=0
wf3(diml,dimr,dimc)=(60,4,4) nnz=271:4.135e-03MB
qtensor3: wf3 own=1 _data=0x7fdb1284e400
qinfo3: wf3 sym=(6) dir=1,1,1
 qbond: qrow nsym=5 dimAll=60
 (4):23 (3):16 (5):16 (6):3 (2):2
 qbond: qcol nsym=3 dimAll=4
 (0):1 (2):1 (1):2
 qbond: qmid nsym=3 dimAll=4
 (0):1 (2):1 (1):2
total no. of nonzero blocks=9 nblocks=45 size=271:4.135e-03MB
duration_diagGPU:1.150e-04
duration_diagreduce:3.000e-05
duration_diagtransform:1.000e-06
iter   ieig        eigenvalue        ediff      rnorm   nsub  nmvp   time/s    tav/s
    1   0 -      -3.236066220801 -1.003e+03  4.572e-05    2     2  4.504e-03 2.252e-03
    1   1 -      -2.884885148720 -1.003e+03  5.067e-05    2     2  4.504e-03 2.252e-03
    2   0 +      -3.236066221703 -9.022e-10  9.154e-06    4     4  9.681e-03 2.420e-03
    2   1 -      -2.884885149954 -1.234e-09  1.190e-05    4     4  9.681e-03 2.420e-03
    3   0 +      -3.236066221703 -2.185e-13  9.128e-06    5     5  1.199e-02 2.397e-03
    3   1 +      -2.884885150037 -8.320e-11  6.213e-06    5     5  1.199e-02 2.397e-03
TIMING FOR Davidson : 1.269e-02  T(cal/comm/sub/rest)=5.567e-03,4.179e-03,1.310e-04,2.815e-03
optimized energies: isweep=0 ibond=3 dots=1 e[0]=-3.2360662217 nmvp=5
optimized energies: isweep=0 ibond=3 dots=1 e[1]=-2.88488515004 nmvp=5
CPUmem: VM:5.588e-09GB RSS:8.202e-04GB  Timing: User:1.663e+00S Sys:3.806e-01S Total:2.044e+00S
 qops: oplist=CABPQSH nops=C:2 A:2 B:3 P:13 Q:16 S:4 H:1 
        dim(bra,ket)=16,16 size(op)=70:1.068e-03MB size(tot)=2156:3.290e-02MB:3.213e-05GB
CPUmem: VM:0.000e+00GB RSS:0.000e+00GB  Timing: User:1.669e+00S Sys:3.831e-01S Total:2.052e+00S
check ||H-H.dagger||=0.000e+00 coord=(4,0) rank=0
----- TIMING FOR oper_renorm : 0.0018 S T(init/kernel/comm)=-1.73e+09,1.73e+09,2.1e-05 rank=0 -----
CPUmem: VM:5.588e-09GB RSS:8.202e-04GB  Timing: User:1.674e+00S Sys:3.847e-01S Total:2.059e+00S
comb::display_size qkind=qNK
 rbases: len=6 mem=24:3.662e-04MB:3.576e-07GB
 sites: len=6 mem=4559:6.956e-02MB:6.793e-05GB
 rwfuns: len=2 mem=4:6.104e-05MB:5.960e-08GB
 cpsi: len=2 mem=1820:2.777e-02MB:2.712e-05GB
total mem of comb=6407:9.776e-02MB:9.547e-05GB
----- TIMING FOR cleanup: 5.250e-04 T(join&erase/save/remove)=7.300e-05,3.330e-04,1.190e-04 S -----
CPUmem: VM:1.863e-09GB RSS:4.027e+08GB  Timing: User:1.676e+00S Sys:3.860e-01S Total:2.062e+00S

isweep=0 ibond=4/seqsize=6 dots=1 dbond=(2,0)-(3,0) forward=0 cturn=0
----------------------------------------------------------------------
ctns::sweep_onedot ifabelian=1 alg_hvec=3 alg_renorm=2 mpisize=2 maxthreads=8
CPUmem: VM:1.863e-09GB RSS:4.027e+08GB  Timing: User:1.677e+00S Sys:3.861e-01S Total:2.063e+00S
comb::display_size qkind=qNK
 rbases: len=6 mem=24:3.662e-04MB:3.576e-07GB
 sites: len=6 mem=4559:6.956e-02MB:6.793e-05GB
 rwfuns: len=2 mem=4:6.104e-05MB:5.960e-08GB
 cpsi: len=2 mem=1820:2.777e-02MB:2.712e-05GB
total mem of comb=6407:9.776e-02MB:9.547e-05GB
ctns::topology::check_partition: (sl,sr,sc)=3,2,1 ifNC=0
wf3(diml,dimr,dimc)=(60,16,4) nnz=910:1.389e-02MB
qtensor3: wf3 own=1 _data=0x7fdb14070800
qinfo3: wf3 sym=(6) dir=1,1,1
 qbond: qrow nsym=5 dimAll=60
 (3):20 (2):15 (4):15 (5):6 (1):4
 qbond: qcol nsym=5 dimAll=16
 (0):1 (2):6 (1):4 (4):1 (3):4
 qbond: qmid nsym=3 dimAll=4
 (0):1 (2):1 (1):2
total no. of nonzero blocks=13 nblocks=75 size=910:1.389e-02MB
duration_diagGPU:5.840e-04
duration_diagreduce:6.000e-06
duration_diagtransform:2.000e-06
iter   ieig        eigenvalue        ediff      rnorm   nsub  nmvp   time/s    tav/s
    1   0 -      -3.236066221703 -1.003e+03  3.861e-04    2     2  6.137e-03 3.069e-03
    1   1 -      -2.884885150037 -1.003e+03  3.455e-04    2     2  6.137e-03 3.069e-03
    2   0 -      -3.236066272841 -5.114e-08  8.119e-05    4     4  1.489e-02 3.723e-03
    2   1 -      -2.884885195452 -4.542e-08  8.392e-05    4     4  1.489e-02 3.723e-03
    3   0 -      -3.236066275480 -2.639e-09  2.482e-05    6     6  2.331e-02 3.885e-03
    3   1 -      -2.884885198460 -3.008e-09  3.019e-05    6     6  2.331e-02 3.885e-03
    4   0 +      -3.236066275770 -2.895e-10  9.840e-06    6     8  3.087e-02 3.858e-03
    4   1 -      -2.884885198890 -4.295e-10  1.484e-05    6     8  3.087e-02 3.858e-03
    5   0 +      -3.236066275771 -1.474e-12  9.755e-06    5     9  3.502e-02 3.892e-03
    5   1 +      -2.884885199012 -1.223e-10  8.335e-06    5     9  3.502e-02 3.892e-03
TIMING FOR Davidson : 3.681e-02  T(cal/comm/sub/rest)=2.063e-02,1.097e-03,8.940e-04,1.418e-02
optimized energies: isweep=0 ibond=4 dots=1 e[0]=-3.23606627577 nmvp=9
optimized energies: isweep=0 ibond=4 dots=1 e[1]=-2.88488519901 nmvp=9
CPUmem: VM:0.000e+00GB RSS:0.000e+00GB  Timing: User:1.832e+00S Sys:4.243e-01S Total:2.256e+00S
 qops: oplist=CABPQSH nops=C:3 A:5 B:7 P:6 Q:8 S:3 H:1 
        dim(bra,ket)=60,60 size(op)=902:1.376e-02MB size(tot)=23607:3.602e-01MB:3.518e-04GB
CPUmem: VM:0.000e+00GB RSS:0.000e+00GB  Timing: User:1.850e+00S Sys:4.319e-01S Total:2.282e+00S
check ||H-H.dagger||=0.000e+00 coord=(3,0) rank=0
----- TIMING FOR oper_renorm : 0.00181 S T(init/kernel/comm)=-1.73e+09,1.73e+09,5.3e-05 rank=0 -----
CPUmem: VM:0.000e+00GB RSS:0.000e+00GB  Timing: User:1.858e+00S Sys:4.334e-01S Total:2.291e+00S
comb::display_size qkind=qNK
 rbases: len=6 mem=24:3.662e-04MB:3.576e-07GB
 sites: len=6 mem=1972:3.009e-02MB:2.939e-05GB
 rwfuns: len=2 mem=4:6.104e-05MB:5.960e-08GB
 cpsi: len=2 mem=1820:2.777e-02MB:2.712e-05GB
total mem of comb=3820:5.829e-02MB:5.692e-05GB
----- TIMING FOR cleanup: 5.760e-04 T(join&erase/save/remove)=6.300e-05,3.930e-04,1.200e-04 S -----
CPUmem: VM:9.313e-10GB RSS:4.027e+08GB  Timing: User:1.859e+00S Sys:4.342e-01S Total:2.293e+00S

isweep=0 ibond=5/seqsize=6 dots=1 dbond=(1,0)-(2,0) forward=0 cturn=0
----------------------------------------------------------------------
ctns::sweep_onedot ifabelian=1 alg_hvec=3 alg_renorm=2 mpisize=2 maxthreads=8
CPUmem: VM:9.313e-10GB RSS:4.027e+08GB  Timing: User:1.859e+00S Sys:4.342e-01S Total:2.293e+00S
comb::display_size qkind=qNK
 rbases: len=6 mem=24:3.662e-04MB:3.576e-07GB
 sites: len=6 mem=1972:3.009e-02MB:2.939e-05GB
 rwfuns: len=2 mem=4:6.104e-05MB:5.960e-08GB
 cpsi: len=2 mem=1820:2.777e-02MB:2.712e-05GB
total mem of comb=3820:5.829e-02MB:5.692e-05GB
ctns::topology::check_partition: (sl,sr,sc)=2,3,1 ifNC=1
wf3(diml,dimr,dimc)=(16,60,4) nnz=910:1.389e-02MB
qtensor3: wf3 own=1 _data=0x7fdb14833600
qinfo3: wf3 sym=(6) dir=1,1,1
 qbond: qrow nsym=5 dimAll=16
 (0):1 (2):6 (1):4 (4):1 (3):4
 qbond: qcol nsym=5 dimAll=60
 (3):20 (2):15 (4):15 (5):6 (1):4
 qbond: qmid nsym=3 dimAll=4
 (0):1 (2):1 (1):2
total no. of nonzero blocks=13 nblocks=75 size=910:1.389e-02MB
duration_diagGPU:5.400e-04
duration_diagreduce:1.400e-05
duration_diagtransform:2.000e-06
iter   ieig        eigenvalue        ediff      rnorm   nsub  nmvp   time/s    tav/s
    1   0 -      -3.236066271498 -1.003e+03  1.256e-04    2     2  6.846e-03 3.423e-03
    1   1 -      -2.884885197056 -1.003e+03  6.564e-05    2     2  6.846e-03 3.423e-03
    2   0 -      -3.236066275537 -4.039e-09  1.856e-05    4     4  1.339e-02 3.346e-03
    2   1 +      -2.884885198257 -1.201e-09  9.142e-06    4     4  1.339e-02 3.346e-03
    3   0 +      -3.236066275641 -1.047e-10  4.255e-06    5     5  1.685e-02 3.371e-03
    3   1 +      -2.884885198257 -1.106e-13  9.135e-06    5     5  1.685e-02 3.371e-03
TIMING FOR Davidson : 1.864e-02  T(cal/comm/sub/rest)=1.086e-02,5.850e-04,2.160e-04,6.984e-03
optimized energies: isweep=0 ibond=5 dots=1 e[0]=-3.23606627564 nmvp=5
optimized energies: isweep=0 ibond=5 dots=1 e[1]=-2.88488519826 nmvp=5
CPUmem: VM:0.000e+00GB RSS:0.000e+00GB  Timing: User:1.938e+00S Sys:4.556e-01S Total:2.393e+00S
 qops: oplist=CABPQSH nops=C:4 A:10 B:13 P:1 Q:2 S:2 H:1 
        dim(bra,ket)=60,60 size(op)=1048:1.599e-02MB size(tot)=25688:3.920e-01MB:3.828e-04GB
CPUmem: VM:0.000e+00GB RSS:0.000e+00GB  Timing: User:1.965e+00S Sys:4.660e-01S Total:2.431e+00S
check ||H-H.dagger||=0.000e+00 coord=(2,0) rank=0
----- TIMING FOR oper_renorm : 0.0025 S T(init/kernel/comm)=-1.73e+09,1.73e+09,0.000146 rank=0 -----
CPUmem: VM:0.000e+00GB RSS:0.000e+00GB  Timing: User:1.976e+00S Sys:4.680e-01S Total:2.444e+00S
comb::display_size qkind=qNK
 rbases: len=6 mem=24:3.662e-04MB:3.576e-07GB
 sites: len=6 mem=4548:6.940e-02MB:6.777e-05GB
 rwfuns: len=2 mem=4:6.104e-05MB:5.960e-08GB
 cpsi: len=2 mem=540:8.240e-03MB:8.047e-06GB
total mem of comb=5116:7.806e-02MB:7.623e-05GB
----- TIMING FOR cleanup: 6.430e-04 T(join&erase/save/remove)=1.170e-04,4.100e-04,1.160e-04 S -----
CPUmem: VM:1.863e-09GB RSS:4.027e+08GB  Timing: User:1.977e+00S Sys:4.692e-01S Total:2.447e+00S

======================================================================
sweep_data::summary isweep=0 mpisize=2 maxthreads=8
----------------------------------------------------------------------
sweep parameters: isweep=0 dots=1 dcut=60 eps=1.000e-05 noise=1.000e-05
 ibond=0 bond=(1,0)-(2,0) forward=1 deff=16 dwt=+0.000e+00 nmvp=9 e[0]=-3.23606627879 e[1]=-2.88488519441 t=0.0297
 ibond=1 bond=(2,0)-(3,0) forward=1 deff=60 dwt=+1.481e-09 nmvp=5 e[0]=-3.23606627986 e[1]=-2.8848852002 t=0.0382
 ibond=2 bond=(3,0)-(4,0) forward=1 deff=60 dwt=+1.250e-09 nmvp=3 e[0]=-3.23606627582 e[1]=-2.88488519903 t=0.0299
 ibond=3 bond=(3,0)-(4,0) forward=0 deff=16 dwt=+0.000e+00 nmvp=5 e[0]=-3.2360662217 e[1]=-2.88488515004 t=0.0178
 ibond=4 bond=(2,0)-(3,0) forward=0 deff=60 dwt=+1.475e-09 nmvp=9 e[0]=-3.23606627577 e[1]=-2.88488519901 t=0.0455
 ibond=5 bond=(1,0)-(2,0) forward=0 deff=60 dwt=+1.480e-09 nmvp=5 e[0]=-3.23606627564 e[1]=-2.88488519826 t=0.0318
 eav_max=-3.06047568587 [ibond=3]  dwt_min=0.000e+00 [ibond=0]
 eav_min=-3.06047574003 [ibond=1]  dwt_max=1.481e-09 [ibond=1]
 eav_diff=5.41606524074e-08
 sweep energies: isweep=0 dots=1 dcut=60 deff=60 dwt=+1.481e-09 e[0]=-3.23606627986
 sweep energies: isweep=0 dots=1 dcut=60 deff=60 dwt=+1.481e-09 e[1]=-2.8848852002
----------------------------------------------------------------------
summary of sweep optimization up to isweep=0 mpisize=2 maxthreads=8
schedule: isweep, dots, dcut, eps, noise | nmvp | Tsweep/S | Taccum/S | t_inter/S t_gemm/S t_red/S t_blas/S per
            0  1      60 1.000e-05 1.000e-05 | 36 | 1.933e-01 | 1.933e-01 | 0.000e+00 0.000e+00 0.000e+00 0.000e+00 0
results: isweep, dcut, dwt, energies (delta_e)
            0      60 +1.481e-09 e[0]=-3.23606627986 (0.000e+00) e[1]=-2.8848852002 (0.000e+00)
======================================================================

ctns::sweep_final: convert into RCF & save into ./scratch/rcanon_isweep0
----------------------------------------------------------------------

ctns::rcanon_save fname=./scratch/rcanon_isweep0

ctns::rcanon_check thresh_ortho=1.000e-08
 idx=0 node=(5,0) Drow=4 maxdiff=0.000e+00 deviate=0
 idx=1 node=(4,0) Drow=16 maxdiff=4.441e-16 deviate=0
 idx=2 node=(3,0) Drow=60 maxdiff=4.164e-15 deviate=0
 idx=3 node=(2,0) Drow=60 maxdiff=5.048e-15 deviate=0
 idx=4 node=(1,0) Drow=8 maxdiff=9.805e-16 deviate=0
 idx=5 node=(0,0) Drow=2 maxdiff=2.486e-16 deviate=0
qtensor2: wf2 own=1 _data=0x600003e78980
qinfo2: wf2 sym=(0) dir=0,1
 qbond: qrow nsym=1 dimAll=2
 (6):2
 qbond: qcol nsym=1 dimAll=2
 (6):2
total no. of nonzero blocks=1 nblocks=1 size=4:6.104e-05MB
i=0 idx=0 block[0:(6),0:(6)] dim0,dim1=(2,2) size=4
 dtensor2: blk_0 size=(2,2) _data=0x600003e78980
(-1.0000e+00,1.9949e-17) (-3.4694e-18,-7.4810e-18) 
(-3.4694e-18,-5.4210e-19) (1.0000e+00,-8.6736e-18) 
check wf2*wf2.H():
 rwfuns: nroots=2 maxdiff=4.9664e-16 deviate=0
----- TIMING FOR ctns::rcanon_check : 2.500e-04 S -----
..... end of isweep = 0 .....

======================================================================
sweep parameters: isweep=1 dots=1 dcut=60 eps=1e-05 noise=1e-05
======================================================================

ctns::sweep_init: nroots=2 sym_state=(6) singlet=0
qtensor3: site0new own=1 _data=0x600000f5d440
qinfo3: site0new sym=(0) dir=1,0,1
 qbond: qrow nsym=1 dimAll=1
 (0):1
 qbond: qcol nsym=3 dimAll=4
 (0):1 (2):1 (1):2
 qbond: qmid nsym=3 dimAll=4
 (0):1 (2):1 (1):2
total no. of nonzero blocks=3 nblocks=9 size=6:9.16e-05MB
comb::display_size qkind=qNK
 rbases: len=6 mem=24:0.000366MB:3.58e-07GB
 sites: len=6 mem=5018:0.0766MB:7.48e-05GB
 rwfuns: len=2 mem=4:6.1e-05MB:5.96e-08GB
 cpsi: len=2 mem=540:0.00824MB:8.05e-06GB
total mem of comb=5586:0.0852MB:8.32e-05GB

isweep=1 ibond=0/seqsize=6 dots=1 dbond=(1,0)-(2,0) forward=1 cturn=0
----------------------------------------------------------------------
ctns::sweep_onedot ifabelian=1 alg_hvec=3 alg_renorm=2 mpisize=2 maxthreads=8
CPUmem: VM:4.291e+09GB RSS:2.670e-05GB  Timing: User:1.989e+00S Sys:4.742e-01S Total:2.463e+00S
comb::display_size qkind=qNK
 rbases: len=6 mem=24:3.662e-04MB:3.576e-07GB
 sites: len=6 mem=5018:7.657e-02MB:7.477e-05GB
 rwfuns: len=2 mem=4:6.104e-05MB:5.960e-08GB
 cpsi: len=2 mem=540:8.240e-03MB:8.047e-06GB
total mem of comb=5586:8.524e-02MB:8.324e-05GB
ctns::topology::check_partition: (sl,sr,sc)=1,4,1 ifNC=1
wf3(diml,dimr,dimc)=(4,60,4) nnz=270:4.120e-03MB
qtensor3: wf3 own=1 _data=0x7fdb13816a00
qinfo3: wf3 sym=(6) dir=1,1,1
 qbond: qrow nsym=3 dimAll=4
 (0):1 (2):1 (1):2
 qbond: qcol nsym=5 dimAll=60
 (4):24 (5):16 (3):14 (6):4 (2):2
 qbond: qmid nsym=3 dimAll=4
 (0):1 (2):1 (1):2
total no. of nonzero blocks=9 nblocks=45 size=270:4.120e-03MB
duration_diagGPU:1.740e-04
duration_diagreduce:5.000e-06
duration_diagtransform:1.000e-06
iter   ieig        eigenvalue        ediff      rnorm   nsub  nmvp   time/s    tav/s
    1   0 -      -3.236066221435 -1.003e+03  4.383e-05    2     2  4.680e-03 2.340e-03
    1   1 -      -2.884885152256 -1.003e+03  4.055e-05    2     2  4.680e-03 2.340e-03
    2   0 +      -3.236066222296 -8.611e-10  9.166e-06    4     4  1.003e-02 2.509e-03
    2   1 -      -2.884885153166 -9.100e-10  1.321e-05    4     4  1.003e-02 2.509e-03
    3   0 +      -3.236066222300 -3.464e-12  8.871e-06    5     5  1.224e-02 2.448e-03
    3   1 +      -2.884885153301 -1.350e-10  8.362e-06    5     5  1.224e-02 2.448e-03
TIMING FOR Davidson : 1.294e-02  T(cal/comm/sub/rest)=5.526e-03,4.527e-03,1.330e-04,2.755e-03
optimized energies: isweep=1 ibond=0 dots=1 e[0]=-3.2360662223 nmvp=5
optimized energies: isweep=1 ibond=0 dots=1 e[1]=-2.8848851533 nmvp=5
CPUmem: VM:6.519e-09GB RSS:9.041e-04GB  Timing: User:2.046e+00S Sys:4.925e-01S Total:2.539e+00S
 qops: oplist=CABPQSH nops=C:2 A:1 B:2 P:10 Q:13 S:4 H:1 
        dim(bra,ket)=16,16 size(op)=70:1.068e-03MB size(tot)=1764:2.692e-02MB:2.629e-05GB
CPUmem: VM:0.000e+00GB RSS:0.000e+00GB  Timing: User:2.052e+00S Sys:4.949e-01S Total:2.546e+00S
check ||H-H.dagger||=0.000e+00 coord=(1,0) rank=0
----- TIMING FOR oper_renorm : 0.00149 S T(init/kernel/comm)=-1.73e+09,1.73e+09,2.1e-05 rank=0 -----
CPUmem: VM:6.519e-09GB RSS:4.027e+08GB  Timing: User:2.057e+00S Sys:4.964e-01S Total:2.553e+00S
comb::display_size qkind=qNK
 rbases: len=6 mem=24:3.662e-04MB:3.576e-07GB
 sites: len=6 mem=4548:6.940e-02MB:6.777e-05GB
 rwfuns: len=2 mem=4:6.104e-05MB:5.960e-08GB
 cpsi: len=2 mem=1820:2.777e-02MB:2.712e-05GB
total mem of comb=6396:9.760e-02MB:9.531e-05GB
----- TIMING FOR cleanup: 4.940e-04 T(join&erase/save/remove)=6.700e-05,3.150e-04,1.120e-04 S -----
CPUmem: VM:1.863e-09GB RSS:4.027e+08GB  Timing: User:2.058e+00S Sys:4.977e-01S Total:2.556e+00S

isweep=1 ibond=1/seqsize=6 dots=1 dbond=(2,0)-(3,0) forward=1 cturn=0
----------------------------------------------------------------------
ctns::sweep_onedot ifabelian=1 alg_hvec=3 alg_renorm=2 mpisize=2 maxthreads=8
CPUmem: VM:1.863e-09GB RSS:4.027e+08GB  Timing: User:2.058e+00S Sys:4.977e-01S Total:2.556e+00S
comb::display_size qkind=qNK
 rbases: len=6 mem=24:3.662e-04MB:3.576e-07GB
 sites: len=6 mem=4548:6.940e-02MB:6.777e-05GB
 rwfuns: len=2 mem=4:6.104e-05MB:5.960e-08GB
 cpsi: len=2 mem=1820:2.777e-02MB:2.712e-05GB
total mem of comb=6396:9.760e-02MB:9.531e-05GB
ctns::topology::check_partition: (sl,sr,sc)=2,3,1 ifNC=1
wf3(diml,dimr,dimc)=(16,60,4) nnz=910:1.389e-02MB
qtensor3: wf3 own=1 _data=0x7fdaf301c600
qinfo3: wf3 sym=(6) dir=1,1,1
 qbond: qrow nsym=5 dimAll=16
 (0):1 (2):6 (1):4 (4):1 (3):4
 qbond: qcol nsym=5 dimAll=60
 (3):20 (2):15 (4):15 (5):6 (1):4
 qbond: qmid nsym=3 dimAll=4
 (0):1 (2):1 (1):2
total no. of nonzero blocks=13 nblocks=75 size=910:1.389e-02MB
duration_diagGPU:5.120e-04
duration_diagreduce:7.000e-06
duration_diagtransform:3.000e-06
iter   ieig        eigenvalue        ediff      rnorm   nsub  nmvp   time/s    tav/s
    1   0 -      -3.236066222300 -1.003e+03  3.827e-04    2     2  6.480e-03 3.240e-03
    1   1 -      -2.884885153301 -1.003e+03  3.322e-04    2     2  6.480e-03 3.240e-03
    2   0 -      -3.236066273255 -5.095e-08  7.427e-05    4     4  1.361e-02 3.403e-03
    2   1 -      -2.884885195237 -4.194e-08  7.716e-05    4     4  1.361e-02 3.403e-03
    3   0 -      -3.236066275394 -2.139e-09  2.149e-05    6     6  2.079e-02 3.465e-03
    3   1 -      -2.884885197893 -2.656e-09  2.830e-05    6     6  2.079e-02 3.465e-03
    4   0 +      -3.236066275599 -2.046e-10  8.676e-06    6     8  2.736e-02 3.420e-03
    4   1 -      -2.884885198366 -4.735e-10  1.589e-05    6     8  2.736e-02 3.420e-03
    5   0 +      -3.236066275600 -1.696e-12  8.458e-06    5     9  3.112e-02 3.458e-03
    5   1 -      -2.884885198643 -2.762e-10  1.849e-05    5     9  3.112e-02 3.458e-03
    6   0 +      -3.236066275600 -1.332e-13  8.414e-06    4    10  3.445e-02 3.445e-03
    6   1 -      -2.884885200890 -2.248e-09  1.325e-04    4    10  3.445e-02 3.445e-03
    7   0 +      -3.236066275601 -5.915e-13  8.257e-06    4    11  3.868e-02 3.517e-03
    7   1 -      -2.989291983126 -1.044e-01  2.710e-01    4    11  3.868e-02 3.517e-03
    8   0 +      -3.236066275602 -8.171e-13  8.175e-06    4    12  4.231e-02 3.526e-03
    8   1 -      -3.025261442499 -3.597e-02  1.830e-01    4    12  4.231e-02 3.526e-03
    9   0 +      -3.236066275602 -1.892e-13  8.207e-06    4    13  4.558e-02 3.506e-03
    9   1 -      -3.055282610125 -3.002e-02  8.453e-02    4    13  4.558e-02 3.506e-03
   10   0 +      -3.236066275604 -2.315e-12  8.036e-06    4    14  4.868e-02 3.477e-03
   10   1 -      -3.059028834322 -3.746e-03  4.938e-02    4    14  4.868e-02 3.477e-03
   11   0 +      -3.236066275605 -2.460e-13  8.091e-06    4    15  5.243e-02 3.495e-03
   11   1 -      -3.060965017425 -1.936e-03  3.243e-02    4    15  5.243e-02 3.495e-03
   12   0 +      -3.236066275609 -4.527e-12  7.653e-06    4    16  5.565e-02 3.478e-03
   12   1 -      -3.061782884725 -8.179e-04  2.300e-02    4    16  5.565e-02 3.478e-03
   13   0 +      -3.236066275609 -4.263e-14  7.656e-06    4    17  5.919e-02 3.482e-03
   13   1 -      -3.062178081237 -3.952e-04  1.545e-02    4    17  5.919e-02 3.482e-03
   14   0 +      -3.236066275610 -6.946e-13  7.579e-06    4    18  6.319e-02 3.510e-03
   14   1 -      -3.062387046940 -2.090e-04  1.138e-02    4    18  6.319e-02 3.510e-03
   15   0 +      -3.236066275610  1.332e-15  7.579e-06    4    19  6.632e-02 3.490e-03
   15   1 -      -3.062478982834 -9.194e-05  6.515e-03    4    19  6.632e-02 3.490e-03
   16   0 +      -3.236066275610 -3.331e-14  7.568e-06    4    20  6.984e-02 3.492e-03
   16   1 -      -3.062503067572 -2.408e-05  4.036e-03    4    20  6.984e-02 3.492e-03
   17   0 +      -3.236066275610 -6.217e-14  7.559e-06    4    21  7.436e-02 3.541e-03
   17   1 -      -3.062514524649 -1.146e-05  2.442e-03    4    21  7.436e-02 3.541e-03
   18   0 +      -3.236066275610 -5.329e-15  7.558e-06    4    22  7.797e-02 3.544e-03
   18   1 -      -3.062518121173 -3.597e-06  1.121e-03    4    22  7.797e-02 3.544e-03
   19   0 +      -3.236066275610 -2.665e-15  7.558e-06    4    23  8.125e-02 3.533e-03
   19   1 -      -3.062518908505 -7.873e-07  6.758e-04    4    23  8.125e-02 3.533e-03
   20   0 +      -3.236066275610  0.000e+00  7.559e-06    4    24  8.495e-02 3.540e-03
   20   1 -      -3.062519195156 -2.867e-07  3.561e-04    4    24  8.495e-02 3.540e-03
   21   0 +      -3.236066275610 -3.970e-13  7.578e-06    4    25  8.817e-02 3.527e-03
   21   1 -      -3.062519279364 -8.421e-08  2.096e-04    4    25  8.817e-02 3.527e-03
   22   0 +      -3.236066275611 -1.106e-12  7.572e-06    4    26  9.093e-02 3.497e-03
   22   1 -      -3.062519310709 -3.134e-08  1.386e-04    4    26  9.093e-02 3.497e-03
   23   0 +      -3.236066275612 -1.014e-12  7.525e-06    4    27  9.409e-02 3.485e-03
   23   1 -      -3.062519323471 -1.276e-08  8.635e-05    4    27  9.409e-02 3.485e-03
   24   0 +      -3.236066275613 -8.837e-13  7.441e-06    4    28  9.758e-02 3.485e-03
   24   1 -      -3.062519327777 -4.306e-09  4.739e-05    4    28  9.758e-02 3.485e-03
   25   0 +      -3.236066275614 -3.135e-13  7.385e-06    4    29  1.009e-01 3.479e-03
   25   1 -      -3.062519329332 -1.554e-09  3.089e-05    4    29  1.009e-01 3.479e-03
   26   0 +      -3.236066275614 -3.553e-15  7.387e-06    4    30  1.044e-01 3.481e-03
   26   1 -      -3.062519330049 -7.174e-10  1.779e-05    4    30  1.044e-01 3.481e-03
   27   0 +      -3.236066275614 -1.954e-14  7.391e-06    4    31  1.081e-01 3.488e-03
   27   1 -      -3.062519330246 -1.973e-10  1.015e-05    4    31  1.081e-01 3.488e-03
   28   0 +      -3.236066275614 -4.357e-13  7.369e-06    4    32  1.116e-01 3.487e-03
   28   1 +      -3.062519330314 -6.752e-11  5.817e-06    4    32  1.116e-01 3.487e-03
TIMING FOR Davidson : 1.135e-01  T(cal/comm/sub/rest)=7.106e-02,2.131e-03,2.460e-03,3.780e-02
optimized energies: isweep=1 ibond=1 dots=1 e[0]=-3.23606627561 nmvp=32
optimized energies: isweep=1 ibond=1 dots=1 e[1]=-3.06251933031 nmvp=32
CPUmem: VM:3.725e-09GB RSS:0.000e+00GB  Timing: User:2.516e+00S Sys:6.086e-01S Total:3.125e+00S
 qops: oplist=CABPQSH nops=C:3 A:6 B:8 P:5 Q:7 S:3 H:1 
        dim(bra,ket)=60,60 size(op)=902:1.376e-02MB size(tot)=23607:3.602e-01MB:3.518e-04GB
CPUmem: VM:0.000e+00GB RSS:0.000e+00GB  Timing: User:2.532e+00S Sys:6.155e-01S Total:3.147e+00S
check ||H-H.dagger||=0.000e+00 coord=(2,0) rank=0
----- TIMING FOR oper_renorm : 0.00181 S T(init/kernel/comm)=-1.73e+09,1.73e+09,6.3e-05 rank=0 -----
CPUmem: VM:3.725e-09GB RSS:4.027e+08GB  Timing: User:2.537e+00S Sys:6.162e-01S Total:3.153e+00S
comb::display_size qkind=qNK
 rbases: len=6 mem=24:3.662e-04MB:3.576e-07GB
 sites: len=6 mem=1972:3.009e-02MB:2.939e-05GB
 rwfuns: len=2 mem=4:6.104e-05MB:5.960e-08GB
 cpsi: len=2 mem=1820:2.777e-02MB:2.712e-05GB
total mem of comb=3820:5.829e-02MB:5.692e-05GB
----- TIMING FOR cleanup: 6.550e-04 T(join&erase/save/remove)=6.600e-05,4.490e-04,1.400e-04 S -----
CPUmem: VM:9.313e-10GB RSS:4.027e+08GB  Timing: User:2.538e+00S Sys:6.174e-01S Total:3.155e+00S

isweep=1 ibond=2/seqsize=6 dots=1 dbond=(3,0)-(4,0) forward=1 cturn=0
----------------------------------------------------------------------
ctns::sweep_onedot ifabelian=1 alg_hvec=3 alg_renorm=2 mpisize=2 maxthreads=8
CPUmem: VM:9.313e-10GB RSS:4.027e+08GB  Timing: User:2.538e+00S Sys:6.174e-01S Total:3.155e+00S
comb::display_size qkind=qNK
 rbases: len=6 mem=24:3.662e-04MB:3.576e-07GB
 sites: len=6 mem=1972:3.009e-02MB:2.939e-05GB
 rwfuns: len=2 mem=4:6.104e-05MB:5.960e-08GB
 cpsi: len=2 mem=1820:2.777e-02MB:2.712e-05GB
total mem of comb=3820:5.829e-02MB:5.692e-05GB
ctns::topology::check_partition: (sl,sr,sc)=3,2,1 ifNC=0
wf3(diml,dimr,dimc)=(60,16,4) nnz=910:1.389e-02MB
qtensor3: wf3 own=1 _data=0x7fdb13811600
qinfo3: wf3 sym=(6) dir=1,1,1
 qbond: qrow nsym=5 dimAll=60
 (3):20 (2):15 (4):15 (1):6 (5):4
 qbond: qcol nsym=5 dimAll=16
 (0):1 (2):6 (1):4 (4):1 (3):4
 qbond: qmid nsym=3 dimAll=4
 (0):1 (2):1 (1):2
total no. of nonzero blocks=13 nblocks=75 size=910:1.389e-02MB
duration_diagGPU:7.130e-04
duration_diagreduce:1.300e-05
duration_diagtransform:3.000e-06
iter   ieig        eigenvalue        ediff      rnorm   nsub  nmvp   time/s    tav/s
    1   0 -      -3.236066273242 -1.003e+03  1.222e-04    2     2  7.061e-03 3.531e-03
    1   1 -      -3.062519327569 -1.003e+03  1.449e-04    2     2  7.061e-03 3.531e-03
    2   0 -      -3.236066277147 -3.904e-09  1.917e-05    4     4  1.438e-02 3.595e-03
    2   1 -      -3.062519333208 -5.639e-09  1.957e-05    4     4  1.438e-02 3.595e-03
    3   0 +      -3.236066277260 -1.130e-10  4.544e-06    6     6  2.074e-02 3.456e-03
    3   1 +      -3.062519333334 -1.265e-10  4.652e-06    6     6  2.074e-02 3.456e-03
TIMING FOR Davidson : 2.255e-02  T(cal/comm/sub/rest)=1.322e-02,1.040e-03,2.340e-04,8.052e-03
optimized energies: isweep=1 ibond=2 dots=1 e[0]=-3.23606627726 nmvp=6
optimized energies: isweep=1 ibond=2 dots=1 e[1]=-3.06251933333 nmvp=6
CPUmem: VM:0.000e+00GB RSS:0.000e+00GB  Timing: User:2.640e+00S Sys:6.444e-01S Total:3.285e+00S
 qops: oplist=CABPQSH nops=C:4 A:13 B:16 P:2 Q:3 S:2 H:1 
        dim(bra,ket)=60,60 size(op)=1046:1.596e-02MB size(tot)=31300:4.776e-01MB:4.664e-04GB
CPUmem: VM:0.000e+00GB RSS:0.000e+00GB  Timing: User:2.673e+00S Sys:6.571e-01S Total:3.330e+00S
check ||H-H.dagger||=0.000e+00 coord=(3,0) rank=0
----- TIMING FOR oper_renorm : 0.0036 S T(init/kernel/comm)=-1.73e+09,1.73e+09,0.000153 rank=0 -----
CPUmem: VM:0.000e+00GB RSS:4.027e+08GB  Timing: User:2.688e+00S Sys:6.603e-01S Total:3.348e+00S
comb::display_size qkind=qNK
 rbases: len=6 mem=24:3.662e-04MB:3.576e-07GB
 sites: len=6 mem=4544:6.934e-02MB:6.771e-05GB
 rwfuns: len=2 mem=4:6.104e-05MB:5.960e-08GB
 cpsi: len=2 mem=540:8.240e-03MB:8.047e-06GB
total mem of comb=5112:7.800e-02MB:7.617e-05GB
----- TIMING FOR cleanup: 5.970e-04 T(join&erase/save/remove)=1.520e-04,3.500e-04,9.500e-05 S -----
CPUmem: VM:9.313e-10GB RSS:4.027e+08GB  Timing: User:2.690e+00S Sys:6.618e-01S Total:3.351e+00S

isweep=1 ibond=3/seqsize=6 dots=1 dbond=(3,0)-(4,0) forward=0 cturn=0
----------------------------------------------------------------------
ctns::sweep_onedot ifabelian=1 alg_hvec=3 alg_renorm=2 mpisize=2 maxthreads=8
CPUmem: VM:9.313e-10GB RSS:4.027e+08GB  Timing: User:2.690e+00S Sys:6.619e-01S Total:3.352e+00S
comb::display_size qkind=qNK
 rbases: len=6 mem=24:3.662e-04MB:3.576e-07GB
 sites: len=6 mem=4544:6.934e-02MB:6.771e-05GB
 rwfuns: len=2 mem=4:6.104e-05MB:5.960e-08GB
 cpsi: len=2 mem=540:8.240e-03MB:8.047e-06GB
total mem of comb=5112:7.800e-02MB:7.617e-05GB
ctns::topology::check_partition: (sl,sr,sc)=4,1,1 ifNC=0
wf3(diml,dimr,dimc)=(60,4,4) nnz=270:4.120e-03MB
qtensor3: wf3 own=1 _data=0x7fdaf300e600
qinfo3: wf3 sym=(6) dir=1,1,1
 qbond: qrow nsym=5 dimAll=60
 (4):24 (3):16 (5):14 (2):3 (6):3
 qbond: qcol nsym=3 dimAll=4
 (0):1 (2):1 (1):2
 qbond: qmid nsym=3 dimAll=4
 (0):1 (2):1 (1):2
total no. of nonzero blocks=9 nblocks=45 size=270:4.120e-03MB
duration_diagGPU:1.140e-04
duration_diagreduce:3.500e-05
duration_diagtransform:0.000e+00
iter   ieig        eigenvalue        ediff      rnorm   nsub  nmvp   time/s    tav/s
    1   0 -      -3.236066222532 -1.003e+03  4.615e-05    2     2  5.019e-03 2.510e-03
    1   1 -      -3.062519279567 -1.003e+03  4.634e-05    2     2  5.019e-03 2.510e-03
    2   0 +      -3.236066223418 -8.856e-10  9.034e-06    4     4  9.297e-03 2.324e-03
    2   1 +      -3.062519280505 -9.380e-10  9.189e-06    4     4  9.297e-03 2.324e-03
TIMING FOR Davidson : 1.003e-02  T(cal/comm/sub/rest)=4.943e-03,2.551e-03,9.800e-05,2.435e-03
optimized energies: isweep=1 ibond=3 dots=1 e[0]=-3.23606622342 nmvp=4
optimized energies: isweep=1 ibond=3 dots=1 e[1]=-3.0625192805 nmvp=4
CPUmem: VM:8.382e-09GB RSS:1.419e-03GB  Timing: User:2.734e+00S Sys:6.756e-01S Total:3.409e+00S
 qops: oplist=CABPQSH nops=C:2 A:2 B:3 P:13 Q:16 S:4 H:1 
        dim(bra,ket)=16,16 size(op)=70:1.068e-03MB size(tot)=2156:3.290e-02MB:3.213e-05GB
CPUmem: VM:0.000e+00GB RSS:0.000e+00GB  Timing: User:2.739e+00S Sys:6.777e-01S Total:3.417e+00S
check ||H-H.dagger||=0.000e+00 coord=(4,0) rank=0
----- TIMING FOR oper_renorm : 0.00185 S T(init/kernel/comm)=-1.73e+09,1.73e+09,2.4e-05 rank=0 -----
CPUmem: VM:8.382e-09GB RSS:1.419e-03GB  Timing: User:2.745e+00S Sys:6.797e-01S Total:3.425e+00S
comb::display_size qkind=qNK
 rbases: len=6 mem=24:3.662e-04MB:3.576e-07GB
 sites: len=6 mem=4544:6.934e-02MB:6.771e-05GB
 rwfuns: len=2 mem=4:6.104e-05MB:5.960e-08GB
 cpsi: len=2 mem=1820:2.777e-02MB:2.712e-05GB
total mem of comb=6392:9.753e-02MB:9.525e-05GB
----- TIMING FOR cleanup: 4.670e-04 T(join&erase/save/remove)=7.300e-05,2.900e-04,1.040e-04 S -----
CPUmem: VM:1.863e-09GB RSS:4.027e+08GB  Timing: User:2.747e+00S Sys:6.808e-01S Total:3.428e+00S

isweep=1 ibond=4/seqsize=6 dots=1 dbond=(2,0)-(3,0) forward=0 cturn=0
----------------------------------------------------------------------
ctns::sweep_onedot ifabelian=1 alg_hvec=3 alg_renorm=2 mpisize=2 maxthreads=8
CPUmem: VM:1.863e-09GB RSS:4.027e+08GB  Timing: User:2.747e+00S Sys:6.808e-01S Total:3.428e+00S
comb::display_size qkind=qNK
 rbases: len=6 mem=24:3.662e-04MB:3.576e-07GB
 sites: len=6 mem=4544:6.934e-02MB:6.771e-05GB
 rwfuns: len=2 mem=4:6.104e-05MB:5.960e-08GB
 cpsi: len=2 mem=1820:2.777e-02MB:2.712e-05GB
total mem of comb=6392:9.753e-02MB:9.525e-05GB
ctns::topology::check_partition: (sl,sr,sc)=3,2,1 ifNC=0
wf3(diml,dimr,dimc)=(60,16,4) nnz=910:1.389e-02MB
qtensor3: wf3 own=1 _data=0x7fdb14065600
qinfo3: wf3 sym=(6) dir=1,1,1
 qbond: qrow nsym=5 dimAll=60
 (3):20 (2):15 (4):15 (1):6 (5):4
 qbond: qcol nsym=5 dimAll=16
 (0):1 (2):6 (1):4 (4):1 (3):4
 qbond: qmid nsym=3 dimAll=4
 (0):1 (2):1 (1):2
total no. of nonzero blocks=13 nblocks=75 size=910:1.389e-02MB
duration_diagGPU:5.860e-04
duration_diagreduce:1.400e-05
duration_diagtransform:2.000e-06
iter   ieig        eigenvalue        ediff      rnorm   nsub  nmvp   time/s    tav/s
    1   0 -      -3.236066223418 -1.003e+03  3.835e-04    2     2  7.727e-03 3.864e-03
    1   1 -      -3.062519280505 -1.003e+03  3.757e-04    2     2  7.727e-03 3.864e-03
    2   0 -      -3.236066274261 -5.084e-08  8.434e-05    4     4  1.633e-02 4.082e-03
    2   1 -      -3.062519330627 -5.012e-08  7.653e-05    4     4  1.633e-02 4.082e-03
    3   0 -      -3.236066276956 -2.696e-09  2.482e-05    6     6  2.328e-02 3.880e-03
    3   1 -      -3.062519333009 -2.382e-09  2.377e-05    6     6  2.328e-02 3.880e-03
    4   0 +      -3.236066277217 -2.603e-10  9.377e-06    6     8  3.050e-02 3.812e-03
    4   1 -      -3.062519333281 -2.719e-10  1.021e-05    6     8  3.050e-02 3.812e-03
    5   0 +      -3.236066277218 -1.172e-12  9.259e-06    5     9  3.457e-02 3.841e-03
    5   1 +      -3.062519333336 -5.530e-11  5.164e-06    5     9  3.457e-02 3.841e-03
TIMING FOR Davidson : 3.654e-02  T(cal/comm/sub/rest)=2.353e-02,2.010e-04,5.220e-04,1.228e-02
optimized energies: isweep=1 ibond=4 dots=1 e[0]=-3.23606627722 nmvp=9
optimized energies: isweep=1 ibond=4 dots=1 e[1]=-3.06251933334 nmvp=9
CPUmem: VM:0.000e+00GB RSS:0.000e+00GB  Timing: User:2.907e+00S Sys:7.223e-01S Total:3.629e+00S
 qops: oplist=CABPQSH nops=C:3 A:5 B:7 P:6 Q:8 S:3 H:1 
        dim(bra,ket)=60,60 size(op)=902:1.376e-02MB size(tot)=23607:3.602e-01MB:3.518e-04GB
CPUmem: VM:0.000e+00GB RSS:0.000e+00GB  Timing: User:2.923e+00S Sys:7.280e-01S Total:3.651e+00S
check ||H-H.dagger||=0.000e+00 coord=(3,0) rank=0
----- TIMING FOR oper_renorm : 0.00239 S T(init/kernel/comm)=-1.73e+09,1.73e+09,7.6e-05 rank=0 -----
CPUmem: VM:0.000e+00GB RSS:0.000e+00GB  Timing: User:2.930e+00S Sys:7.294e-01S Total:3.659e+00S
comb::display_size qkind=qNK
 rbases: len=6 mem=24:3.662e-04MB:3.576e-07GB
 sites: len=6 mem=1972:3.009e-02MB:2.939e-05GB
 rwfuns: len=2 mem=4:6.104e-05MB:5.960e-08GB
 cpsi: len=2 mem=1820:2.777e-02MB:2.712e-05GB
total mem of comb=3820:5.829e-02MB:5.692e-05GB
----- TIMING FOR cleanup: 6.920e-04 T(join&erase/save/remove)=8.900e-05,4.540e-04,1.490e-04 S -----
CPUmem: VM:1.863e-09GB RSS:4.027e+08GB  Timing: User:2.931e+00S Sys:7.306e-01S Total:3.662e+00S

isweep=1 ibond=5/seqsize=6 dots=1 dbond=(1,0)-(2,0) forward=0 cturn=0
----------------------------------------------------------------------
ctns::sweep_onedot ifabelian=1 alg_hvec=3 alg_renorm=2 mpisize=2 maxthreads=8
CPUmem: VM:1.863e-09GB RSS:4.027e+08GB  Timing: User:2.932e+00S Sys:7.306e-01S Total:3.662e+00S
comb::display_size qkind=qNK
 rbases: len=6 mem=24:3.662e-04MB:3.576e-07GB
 sites: len=6 mem=1972:3.009e-02MB:2.939e-05GB
 rwfuns: len=2 mem=4:6.104e-05MB:5.960e-08GB
 cpsi: len=2 mem=1820:2.777e-02MB:2.712e-05GB
total mem of comb=3820:5.829e-02MB:5.692e-05GB
ctns::topology::check_partition: (sl,sr,sc)=2,3,1 ifNC=1
wf3(diml,dimr,dimc)=(16,60,4) nnz=910:1.389e-02MB
qtensor3: wf3 own=1 _data=0x7fdaf3011a00
qinfo3: wf3 sym=(6) dir=1,1,1
 qbond: qrow nsym=5 dimAll=16
 (0):1 (2):6 (1):4 (4):1 (3):4
 qbond: qcol nsym=5 dimAll=60
 (3):20 (2):15 (4):15 (5):6 (1):4
 qbond: qmid nsym=3 dimAll=4
 (0):1 (2):1 (1):2
total no. of nonzero blocks=13 nblocks=75 size=910:1.389e-02MB
duration_diagGPU:5.280e-04
duration_diagreduce:9.000e-06
duration_diagtransform:3.000e-06
iter   ieig        eigenvalue        ediff      rnorm   nsub  nmvp   time/s    tav/s
    1   0 -      -3.236066274094 -1.003e+03  9.279e-05    2     2  6.746e-03 3.373e-03
    1   1 -      -3.062519330828 -1.003e+03  9.423e-05    2     2  6.746e-03 3.373e-03
    2   0 -      -3.236066276509 -2.414e-09  1.374e-05    4     4  1.411e-02 3.526e-03
    2   1 -      -3.062519333471 -2.643e-09  1.433e-05    4     4  1.411e-02 3.526e-03
    3   0 +      -3.236066276576 -6.715e-11  3.458e-06    6     6  2.092e-02 3.486e-03
    3   1 +      -3.062519333549 -7.784e-11  3.599e-06    6     6  2.092e-02 3.486e-03
TIMING FOR Davidson : 2.299e-02  T(cal/comm/sub/rest)=1.224e-02,1.437e-03,4.740e-04,8.841e-03
optimized energies: isweep=1 ibond=5 dots=1 e[0]=-3.23606627658 nmvp=6
optimized energies: isweep=1 ibond=5 dots=1 e[1]=-3.06251933355 nmvp=6
CPUmem: VM:0.000e+00GB RSS:0.000e+00GB  Timing: User:3.034e+00S Sys:7.571e-01S Total:3.791e+00S
 qops: oplist=CABPQSH nops=C:4 A:10 B:13 P:1 Q:2 S:2 H:1 
        dim(bra,ket)=60,60 size(op)=1054:1.608e-02MB size(tot)=25841:3.943e-01MB:3.851e-04GB
CPUmem: VM:0.000e+00GB RSS:0.000e+00GB  Timing: User:3.068e+00S Sys:7.705e-01S Total:3.839e+00S
check ||H-H.dagger||=0.000e+00 coord=(2,0) rank=0
----- TIMING FOR oper_renorm : 0.0032 S T(init/kernel/comm)=-1.73e+09,1.73e+09,6.4e-05 rank=0 -----
CPUmem: VM:0.000e+00GB RSS:0.000e+00GB  Timing: User:3.081e+00S Sys:7.733e-01S Total:3.854e+00S
comb::display_size qkind=qNK
 rbases: len=6 mem=24:3.662e-04MB:3.576e-07GB
 sites: len=6 mem=4559:6.956e-02MB:6.793e-05GB
 rwfuns: len=2 mem=4:6.104e-05MB:5.960e-08GB
 cpsi: len=2 mem=542:8.270e-03MB:8.076e-06GB
total mem of comb=5129:7.826e-02MB:7.643e-05GB
----- TIMING FOR cleanup: 5.170e-04 T(join&erase/save/remove)=5.800e-05,3.480e-04,1.110e-04 S -----
CPUmem: VM:1.863e-09GB RSS:4.027e+08GB  Timing: User:3.083e+00S Sys:7.746e-01S Total:3.857e+00S

======================================================================
sweep_data::summary isweep=1 mpisize=2 maxthreads=8
----------------------------------------------------------------------
sweep parameters: isweep=1 dots=1 dcut=60 eps=1.000e-05 noise=1.000e-05
 ibond=0 bond=(1,0)-(2,0) forward=1 deff=16 dwt=+0.000e+00 nmvp=5 e[0]=-3.2360662223 e[1]=-2.8848851533 t=0.0181
 ibond=1 bond=(2,0)-(3,0) forward=1 deff=60 dwt=+1.067e-09 nmvp=32 e[0]=-3.23606627561 e[1]=-3.06251933031 t=0.122
 ibond=2 bond=(3,0)-(4,0) forward=1 deff=60 dwt=+1.065e-09 nmvp=6 e[0]=-3.23606627726 e[1]=-3.06251933333 t=0.0375
 ibond=3 bond=(3,0)-(4,0) forward=0 deff=16 dwt=+0.000e+00 nmvp=4 e[0]=-3.23606622342 e[1]=-3.0625192805 t=0.0151
 ibond=4 bond=(2,0)-(3,0) forward=0 deff=60 dwt=+9.433e-10 nmvp=9 e[0]=-3.23606627722 e[1]=-3.06251933334 t=0.0458
 ibond=5 bond=(1,0)-(2,0) forward=0 deff=60 dwt=+1.460e-09 nmvp=6 e[0]=-3.23606627658 e[1]=-3.06251933355 t=0.0375
 eav_max=-3.0604756878 [ibond=0]  dwt_min=0.000e+00 [ibond=0]
 eav_min=-3.1492928053 [ibond=2]  dwt_max=1.460e-09 [ibond=5]
 eav_diff=0.0888171174968
 sweep energies: isweep=1 dots=1 dcut=60 deff=60 dwt=+1.065e-09 e[0]=-3.23606627726
 sweep energies: isweep=1 dots=1 dcut=60 deff=60 dwt=+1.065e-09 e[1]=-3.06251933333
----------------------------------------------------------------------
summary of sweep optimization up to isweep=1 mpisize=2 maxthreads=8
schedule: isweep, dots, dcut, eps, noise | nmvp | Tsweep/S | Taccum/S | t_inter/S t_gemm/S t_red/S t_blas/S per
            0  1      60 1.000e-05 1.000e-05 | 36 | 1.933e-01 | 1.933e-01 | 0.000e+00 0.000e+00 0.000e+00 0.000e+00 0
            1  1      60 1.000e-05 1.000e-05 | 62 | 2.763e-01 | 4.696e-01 | 0.000e+00 0.000e+00 0.000e+00 0.000e+00 0
results: isweep, dcut, dwt, energies (delta_e)
            0      60 +1.481e-09 e[0]=-3.23606627986 (-2.603e-09) e[1]=-2.8848852002 (1.776e-01)
            1      60 +1.065e-09 e[0]=-3.23606627726 (0.000e+00) e[1]=-3.06251933333 (0.000e+00)
======================================================================

ctns::sweep_final: convert into RCF & save into ./scratch/rcanon_isweep1
----------------------------------------------------------------------

ctns::rcanon_save fname=./scratch/rcanon_isweep1

ctns::rcanon_check thresh_ortho=1.000e-08
 idx=0 node=(5,0) Drow=4 maxdiff=0.000e+00 deviate=0
 idx=1 node=(4,0) Drow=16 maxdiff=4.441e-16 deviate=0
 idx=2 node=(3,0) Drow=60 maxdiff=5.028e-15 deviate=0
 idx=3 node=(2,0) Drow=60 maxdiff=4.731e-15 deviate=0
 idx=4 node=(1,0) Drow=8 maxdiff=1.382e-15 deviate=0
 idx=5 node=(0,0) Drow=2 maxdiff=4.004e-16 deviate=0
qtensor2: wf2 own=1 _data=0x600003e6c000
qinfo2: wf2 sym=(0) dir=0,1
 qbond: qrow nsym=1 dimAll=2
 (6):2
 qbond: qcol nsym=1 dimAll=2
 (6):2
total no. of nonzero blocks=1 nblocks=1 size=4:6.104e-05MB
i=0 idx=0 block[0:(6),0:(6)] dim0,dim1=(2,2) size=4
 dtensor2: blk_0 size=(2,2) _data=0x600003e6c000
(1.0408e-17,-2.2118e-17) (1.0000e+00,-1.3010e-17) 
(1.0000e+00,5.2042e-17) (-1.3878e-17,-1.7781e-17) 
check wf2*wf2.H():
 rwfuns: nroots=2 maxdiff=6.2809e-16 deviate=0
----- TIMING FOR ctns::rcanon_check : 1.990e-04 S -----
..... end of isweep = 1 .....

----- TIMING FOR ctns::sweep_opt : 4.783e-01 S -----

Congrats! CTNS calculation finishes successfully. Fri Aug 30 23:25:18 2024

